17:43:14.766853 ARP, Reply bthub is-at e8:ad:a6:d5:69:5d (oui Unknown), length 46
17:43:14.827254 IP 192.168.1.67.54915 > 192.168.1.255.54915: UDP, length 263
17:43:15.826409 IP 192.168.1.67.54915 > 192.168.1.255.54915: UDP, length 263
17:43:16.840658 IP 192.168.1.67.54915 > 192.168.1.255.54915: UDP, length 263
17:43:17.838538 IP 192.168.1.67.54915 > 192.168.1.255.54915: UDP, length 263
17:43:18.827758 IP 192.168.1.67.54915 > 192.168.1.255.54915: UDP, length 263
17:43:19.821783 IP 192.168.1.67.54915 > 192.168.1.255.54915: UDP, length 263
17:43:20.834486 IP 192.168.1.67.54915 > 192.168.1.255.54915: UDP, length 263
17:43:21.837925 IP 192.168.1.67.54915 > 192.168.1.255.54915: UDP, length 263
17:43:22.827654 IP 192.168.1.67.54915 > 192.168.1.255.54915: UDP, length 263
17:43:23.829282 IP 192.168.1.67.54915 > 192.168.1.255.54915: UDP, length 263
17:43:24.819590 IP 192.168.1.67.54915 > 192.168.1.255.54915: UDP, length 263
17:43:25.819763 IP 192.168.1.67.54915 > 192.168.1.255.54915: UDP, length 263
17:43:26.828666 IP 192.168.1.67.54915 > 192.168.1.255.54915: UDP, length 263
17:43:27.823393 IP 192.168.1.67.54915 > 192.168.1.255.54915: UDP, length 263
17:43:28.830688 IP 192.168.1.67.54915 > 192.168.1.255.54915: UDP, length 263
17:43:29.832120 IP 192.168.1.67.54915 > 192.168.1.255.54915: UDP, length 263
17:43:30.835891 IP 192.168.1.67.54915 > 192.168.1.255.54915: UDP, length 263
17:43:31.842730 IP 192.168.1.67.54915 > 192.168.1.255.54915: UDP, length 263
17:43:32.849618 IP 192.168.1.67.54915 > 192.168.1.255.54915: UDP, length 263
17:43:33.110535 ARP, Request who-has 192.168.1.71 tell 192.168.1.67, length 46
17:43:33.110987 IP WINDOWS-FGVFC9Q.48368 > bthub.domain: 23413+ PTR? 71.1.168.192.in-addr.arpa. (43)
17:43:33.112874 IP bthub.domain > WINDOWS-FGVFC9Q.48368: 23413 NXDomain* 0/0/0 (43)
17:43:33.831745 IP 192.168.1.67.54915 > 192.168.1.255.54915: UDP, length 263
17:43:33.966538 ARP, Request who-has 192.168.1.71 tell 192.168.1.67, length 46
17:43:34.836343 IP 192.168.1.67.54915 > 192.168.1.255.54915: UDP, length 263
17:43:34.966486 ARP, Request who-has 192.168.1.71 tell 192.168.1.67, length 46
17:43:35.827078 IP 192.168.1.67.54915 > 192.168.1.255.54915: UDP, length 263
17:43:36.134643 IP 192.168.1.67.61664 > 255.255.255.255.8612: UDP, length 16
17:43:36.134655 IP 192.168.1.67.61664 > 255.255.255.255.8612: UDP, length 16
17:43:36.134816 IP WINDOWS-FGVFC9Q.48368 > bthub.domain: 57553+ PTR? 255.255.255.255.in-addr.arpa. (46)
17:43:36.140814 IP bthub.domain > WINDOWS-FGVFC9Q.48368: 57553 NXDomain 0/1/0 (114)
17:43:36.824019 IP 192.168.1.67.54915 > 192.168.1.255.54915: UDP, length 263
17:43:37.817053 IP 192.168.1.67.54915 > 192.168.1.255.54915: UDP, length 263
17:43:38.122636 ARP, Request who-has WINDOWS-FGVFC9Q tell bthub, length 46
17:43:38.122648 ARP, Reply WINDOWS-FGVFC9Q is-at 08:00:27:7f:7b:af (oui Unknown), length 28
17:43:38.141181 ARP, Request who-has 192.168.1.55 tell 192.168.1.67, length 46
17:43:38.141371 IP WINDOWS-FGVFC9Q.48368 > bthub.domain: 40592+ PTR? 55.1.168.192.in-addr.arpa. (43)
17:43:38.142928 IP bthub.domain > WINDOWS-FGVFC9Q.48368: 40592 NXDomain* 0/0/0 (43)
17:43:38.340532 ARP, Request who-has 192.168.1.56 tell 192.168.1.67, length 46
17:43:38.340672 IP WINDOWS-FGVFC9Q.48368 > bthub.domain: 21019+ PTR? 56.1.168.192.in-addr.arpa. (43)
17:43:38.343140 IP bthub.domain > WINDOWS-FGVFC9Q.48368: 21019 NXDomain* 0/0/0 (43)
17:43:38.540667 ARP, Request who-has 192.168.1.57 tell 192.168.1.67, length 46
17:43:38.540796 IP WINDOWS-FGVFC9Q.48368 > bthub.domain: 10927+ PTR? 57.1.168.192.in-addr.arpa. (43)
17:43:38.542856 IP bthub.domain > WINDOWS-FGVFC9Q.48368: 10927 NXDomain* 0/0/0 (43)
17:43:38.740997 ARP, Request who-has 192.168.1.58 tell 192.168.1.67, length 46
17:43:38.819838 IP 192.168.1.67.54915 > 192.168.1.255.54915: UDP, length 263
17:43:38.941000 ARP, Request who-has 192.168.1.59 tell 192.168.1.67, length 46
17:43:38.966289 ARP, Request who-has 192.168.1.55 tell 192.168.1.67, length 46
17:43:38.966298 ARP, Request who-has 192.168.1.56 tell 192.168.1.67, length 46
17:43:39.142227 ARP, Request who-has 192.168.1.60 tell 192.168.1.67, length 46
17:43:39.342294 ARP, Request who-has 192.168.1.61 tell 192.168.1.67, length 46
17:43:39.466637 ARP, Request who-has 192.168.1.57 tell 192.168.1.67, length 46
17:43:39.466646 ARP, Request who-has 192.168.1.58 tell 192.168.1.67, length 46
17:43:39.466647 ARP, Request who-has 192.168.1.59 tell 192.168.1.67, length 46
17:43:39.542456 ARP, Request who-has 192.168.1.62 tell 192.168.1.67, length 46
17:43:39.743038 ARP, Request who-has 192.168.1.63 tell 192.168.1.67, length 46
17:43:39.819984 IP 192.168.1.67.54915 > 192.168.1.255.54915: UDP, length 263
17:43:39.966401 ARP, Request who-has 192.168.1.55 tell 192.168.1.67, length 46
17:43:39.966423 ARP, Request who-has 192.168.1.56 tell 192.168.1.67, length 46
17:43:39.966424 ARP, Request who-has 192.168.1.60 tell 192.168.1.67, length 46
17:43:39.966425 ARP, Request who-has 192.168.1.61 tell 192.168.1.67, length 46
17:43:40.143187 ARP, Request who-has Galaxy-S7 tell 192.168.1.67, length 46
17:43:40.343133 ARP, Request who-has DESKTOP-2M99IEH tell 192.168.1.67, length 46
17:43:40.466165 ARP, Request who-has 192.168.1.57 tell 192.168.1.67, length 46
17:43:40.466174 ARP, Request who-has 192.168.1.58 tell 192.168.1.67, length 46
17:43:40.466175 ARP, Request who-has 192.168.1.59 tell 192.168.1.67, length 46
17:43:40.466176 ARP, Request who-has 192.168.1.62 tell 192.168.1.67, length 46
17:43:40.466177 ARP, Request who-has 192.168.1.63 tell 192.168.1.67, length 46
17:43:40.543459 ARP, Request who-has 192.168.1.68 tell 192.168.1.67, length 46
